{"version":"0.1","scenario_id":"allston_flood_v1","planner":"baseline","plan_version":1,"t0":0.0,"dt":60.0,"t_end_s":14400.0,"synthetic":["flood extents and timing (keyframes.geojson)","Cottage Farm wastewater numbers except storage_max_m3","substation trip time and all facility dependencies","backup endurance, power and connector values","fleet: vans, truck, crew, generators, fuel","which households are assisted, their needs and the judge","EMS Station 14 as response base; the Treehouse as shelter"],"t_s":[0.0,60.0,120.0,180.0,240.0,300.0,360.0,420.0,480.0,540.0,600.0,660.0,720.0,780.0,840.0,900.0,960.0,1020.0,1080.0,1140.0,1200.0,1260.0,1320.0,1380.0,1440.0,1500.0,1560.0,1620.0,1680.0,1740.0,1800.0,1860.0,1920.0,1980.0,2040.0,2100.0,2160.0,2220.0,2280.0,2340.0,2400.0,2460.0,2520.0,2580.0,2640.0,2700.0,2760.0,2820.0,2880.0,2940.0,3000.0,3060.0,3120.0,3180.0,3240.0,3300.0,3360.0,3420.0,3480.0,3540.0,3600.0,3660.0,3720.0,3780.0,3840.0,3900.0,3960.0,4020.0,4080.0,4140.0,4200.0,4260.0,4320.0,4380.0,4440.0,4500.0,4560.0,4620.0,4680.0,4740.0,4800.0,4860.0,4920.0,4980.0,5040.0,5100.0,5160.0,5220.0,5280.0,5340.0,5400.0,5460.0,5520.0,5580.0,5640.0,5700.0,5760.0,5820.0,5880.0,5940.0,6000.0,6060.0,6120.0,6180.0,6240.0,6300.0,6360.0,6420.0,6480.0,6540.0,6600.0,6660.0,6720.0,6780.0,6840.0,6900.0,6960.0,7020.0,7080.0,7140.0,7200.0,7260.0,7320.0,7380.0,7440.0,7500.0,7560.0,7620.0,7680.0,7740.0,7800.0,7860.0,7920.0,7980.0,8040.0,8100.0,8160.0,8220.0,8280.0,8340.0,8400.0,8460.0,8520.0,8580.0,8640.0,8700.0,8760.0,8820.0,8880.0,8940.0,9000.0,9060.0,9120.0,9180.0,9240.0,9300.0,9360.0,9420.0,9480.0,9540.0,9600.0,9660.0,9720.0,9780.0,9840.0,9900.0,9960.0,10020.0,10080.0,10140.0,10200.0,10260.0,10320.0,10380.0,10440.0,10500.0,10560.0,10620.0,10680.0,10740.0,10800.0,10860.0,10920.0,10980.0,11040.0,11100.0,11160.0,11220.0,11280.0,11340.0,11400.0,11460.0,11520.0,11580.0,11640.0,11700.0,11760.0,11820.0,11880.0,11940.0,12000.0,12060.0,12120.0,12180.0,12240.0,12300.0,12360.0,12420.0,12480.0,12540.0,12600.0,12660.0,12720.0,12780.0,12840.0,12900.0,12960.0,13020.0,13080.0,13140.0,13200.0,13260.0,13320.0,13380.0,13440.0,13500.0,13560.0,13620.0,13680.0,13740.0,13800.0,13860.0,13920.0,13980.0,14040.0,14100.0,14160.0,14220.0,14280.0,14340.0],"tracks":[{"id":"van-1","kind":"van","name":"Van 1","path":[[-71.12674,42.36543],[-71.12664,42.3655],[-71.12649,42.36561],[-71.12641,42.36567],[-71.12633,42.36573],[-71.12625,42.36579],[-71.12618,42.36586],[-71.1261,42.36592],[-71.12603,42.36598],[-71.12597,42.36604],[-71.12591,42.36609],[-71.12584,42.36615],[-71.12578,42.36622],[-71.1256,42.3664],[-71.12526,42.36674],[-71.125,42.36702],[-71.12459,42.36743],[-71.12449,42.36753],[-71.12387,42.36817],[-71.12384,42.3682],[-71.12381,42.36823],[-71.12379,42.36826],[-71.12376,42.36829],[-71.12364,42.36843],[-71.12362,42.36846],[-71.1236,42.36848],[-71.12357,42.36851],[-71.12354,42.36855],[-71.12353,42.36857],[-71.12351,42.36859],[-71.12349,42.36862],[-71.12347,42.36864],[-71.1232,42.36896],[-71.12292,42.36929],[-71.12256,42.36968],[-71.12255,42.3697],[-71.12246,42.3698],[-71.12241,42.36979],[-71.12236,42.36978],[-71.12232,42.36977],[-71.12228,42.36977],[-71.12225,42.36976],[-71.12222,42.36976],[-71.12219,42.36975],[-71.12215,42.36975],[-71.12211,42.36974],[-71.12208,42.36973],[-71.12203,42.36973],[-71.122,42.36973],[-71.12197,42.36972],[-71.12192,42.36972],[-71.12189,42.36972],[-71.12184,42.36972],[-71.12177,42.36971],[-71.12171,42.36971],[-71.12164,42.36971],[-71.12157,42.36971],[-71.12141,42.36972],[-71.12131,42.36973],[-71.12124,42.36973],[-71.12053,42.3698],[-71.12044,42.36981],[-71.12036,42.36982],[-71.12028,42.36982],[-71.1202,42.36983],[-71.12011,42.36983],[-71.12003,42.36983],[-71.11995,42.36984],[-71.11987,42.36984],[-71.11978,42.36984],[-71.11971,42.36983],[-71.11962,42.36983],[-71.11954,42.36983],[-71.11946,42.36982],[-71.11939,42.36982],[-71.11937,42.36982],[-71.11929,42.36981],[-71.11921,42.3698],[-71.11913,42.36979],[-71.11904,42.36978],[-71.11897,42.36977],[-71.11889,42.36976],[-71.11881,42.36975],[-71.11873,42.36974],[-71.11865,42.36972],[-71.11857,42.36971],[-71.11849,42.36969],[-71.11841,42.36967],[-71.11833,42.36965],[-71.11825,42.36963],[-71.1182,42.36962],[-71.11814,42.3696],[-71.11808,42.36958],[-71.11801,42.36956],[-71.11796,42.36953],[-71.1179,42.36951],[-71.11784,42.36948],[-71.11778,42.36946],[-71.11772,42.36943],[-71.11766,42.3694],[-71.11762,42.36937],[-71.11758,42.36935],[-71.11755,42.36933],[-71.11749,42.3693],[-71.11744,42.36927],[-71.1174,42.36924],[-71.11737,42.36922],[-71.11735,42.36921],[-71.11734,42.3692],[-71.11733,42.36919],[-71.11731,42.36917],[-71.11729,42.36916],[-71.11727,42.36914],[-71.11725,42.36913],[-71.11722,42.3691],[-71.11719,42.36907],[-71.11716,42.36905],[-71.11713,42.36902],[-71.11712,42.36901],[-71.1171,42.36899],[-71.11709,42.36897],[-71.11705,42.36894],[-71.11703,42.36891],[-71.11701,42.3689],[-71.117,42.36888],[-71.11699,42.36887],[-71.11698,42.36886],[-71.11697,42.36884],[-71.11695,42.36881],[-71.11692,42.36879],[-71.1169,42.36876],[-71.11687,42.36872],[-71.11683,42.36866],[-71.11681,42.36862],[-71.11677,42.36856],[-71.11673,42.3685],[-71.11669,42.36843],[-71.11665,42.36836],[-71.11661,42.3683],[-71.11657,42.36822],[-71.11654,42.36816],[-71.11651,42.3681],[-71.11648,42.36805],[-71.11645,42.36799],[-71.11643,42.36794],[-71.11639,42.36786],[-71.11636,42.36778],[-71.11636,42.36778],[-71.11632,42.36769],[-71.11626,42.36753],[-71.11624,42.36749],[-71.11622,42.36744],[-71.11621,42.3674],[-71.1162,42.36736],[-71.11618,42.36733],[-71.11617,42.36728],[-71.11613,42.36718],[-71.11612,42.36715],[-71.11611,42.3671],[-71.11609,42.36704],[-71.11606,42.36696],[-71.11605,42.3669],[-71.11603,42.36683],[-71.11601,42.36677],[-71.11599,42.36668],[-71.11598,42.36663],[-71.11598,42.3666],[-71.11597,42.36657],[-71.11597,42.36655],[-71.11597,42.36653],[-71.11596,42.36651],[-71.11596,42.36649],[-71.11595,42.36645],[-71.11595,42.36641],[-71.11595,42.36637],[-71.11594,42.36633],[-71.11594,42.36628],[-71.11594,42.36625],[-71.11594,42.36622],[-71.11593,42.36618],[-71.11593,42.36615],[-71.11593,42.36614],[-71.11593,42.36612],[-71.11593,42.36608],[-71.11593,42.36603],[-71.11593,42.36599],[-71.11593,42.36596],[-71.11593,42.36591],[-71.11594,42.3658],[-71.11598,42.36542],[-71.11599,42.36527],[-71.116,42.36522],[-71.11586,42.36521],[-71.11537,42.36519],[-71.115,42.36517],[-71.11499,42.36523],[-71.11484,42.36575],[-71.11491,42.36575],[-71.1158,42.3658],[-71.1158,42.3658],[-71.11594,42.3658],[-71.11593,42.36591],[-71.11593,42.36596],[-71.11593,42.36599],[-71.11593,42.36603],[-71.11593,42.36608],[-71.11593,42.36612],[-71.11593,42.36614],[-71.11593,42.36615],[-71.11593,42.36618],[-71.11594,42.36622],[-71.11594,42.36625],[-71.11594,42.36628],[-71.11594,42.36633],[-71.11595,42.36637],[-71.11595,42.36641],[-71.11595,42.36645],[-71.11596,42.36649],[-71.11596,42.36651],[-71.11597,42.36653],[-71.11597,42.36655],[-71.11597,42.36657],[-71.11598,42.3666],[-71.11598,42.36663],[-71.11599,42.36668],[-71.11601,42.36677],[-71.11603,42.36683],[-71.11605,42.3669],[-71.11606,42.36696],[-71.11609,42.36704],[-71.11611,42.3671],[-71.11612,42.36715],[-71.11613,42.36718],[-71.11617,42.36728],[-71.11618,42.36733],[-71.1162,42.36736],[-71.11621,42.3674],[-71.11622,42.36744],[-71.11624,42.36749],[-71.11626,42.36753],[-71.11632,42.36769],[-71.11636,42.36778],[-71.11621,42.36778],[-71.11593,42.36778],[-71.11571,42.36777],[-71.11529,42.36776],[-71.11483,42.36776],[-71.11472,42.36775],[-71.11472,42.36768],[-71.11474,42.36722],[-71.11475,42.36716],[-71.11477,42.36714],[-71.11479,42.36711],[-71.11482,42.36706],[-71.11484,42.36703],[-71.11484,42.36703],[-71.11482,42.36706],[-71.11479,42.36711],[-71.11477,42.36714],[-71.11475,42.36716],[-71.11474,42.36722],[-71.11472,42.36768],[-71.11472,42.36775],[-71.11483,42.36776],[-71.11529,42.36776],[-71.11571,42.36777],[-71.11593,42.36778],[-71.11621,42.36778],[-71.11636,42.36778],[-71.11632,42.36769],[-71.11626,42.36753],[-71.11624,42.36749],[-71.11622,42.36744],[-71.11621,42.3674],[-71.1162,42.36736],[-71.11618,42.36733],[-71.11617,42.36728],[-71.11613,42.36718],[-71.11612,42.36715],[-71.11611,42.3671],[-71.11609,42.36704],[-71.11606,42.36696],[-71.11605,42.3669],[-71.11603,42.36683],[-71.11601,42.36677],[-71.11599,42.36668],[-71.11598,42.36663],[-71.11598,42.3666],[-71.11597,42.36657],[-71.11597,42.36655],[-71.11597,42.36653],[-71.11596,42.36651],[-71.11596,42.36649],[-71.11595,42.36645],[-71.11595,42.36641],[-71.11595,42.36637],[-71.11594,42.36633],[-71.11594,42.36628],[-71.11594,42.36625],[-71.11594,42.36622],[-71.11593,42.36618],[-71.11593,42.36615],[-71.11593,42.36614],[-71.11593,42.36612],[-71.11593,42.36608],[-71.11593,42.36603],[-71.11593,42.36599],[-71.11593,42.36596],[-71.11593,42.36591],[-71.11594,42.3658],[-71.11598,42.36542],[-71.11599,42.36527],[-71.116,42.36522],[-71.11601,42.36508],[-71.11601,42.36502],[-71.11602,42.365],[-71.11602,42.36497],[-71.11602,42.3649],[-71.11604,42.36474],[-71.11605,42.36465],[-71.11606,42.36454],[-71.11606,42.36447],[-71.11606,42.36444],[-71.11607,42.36436],[-71.11607,42.36431],[-71.11621,42.3643],[-71.11626,42.3643],[-71.11706,42.36424],[-71.11759,42.3642],[-71.11767,42.36419],[-71.11771,42.36419],[-71.11778,42.36418],[-71.11783,42.36418],[-71.11788,42.36418],[-71.1181,42.36416],[-71.11814,42.36416],[-71.11818,42.36416],[-71.11834,42.36416],[-71.11836,42.36416],[-71.1184,42.36416],[-71.1186,42.36414],[-71.11867,42.36414],[-71.11874,42.36413],[-71.11881,42.36412],[-71.11891,42.3641],[-71.11955,42.36405],[-71.11994,42.36402],[-71.12001,42.36401],[-71.1201,42.364],[-71.1202,42.36399],[-71.1202,42.36399],[-71.1201,42.364],[-71.12001,42.36401],[-71.11994,42.36402],[-71.11955,42.36405],[-71.11891,42.3641],[-71.11885,42.3641],[-71.11879,42.3641],[-71.11872,42.36409],[-71.11866,42.36408],[-71.11859,42.36407],[-71.11853,42.36405],[-71.11848,42.36404],[-71.11843,42.36402],[-71.11841,42.36401],[-71.11839,42.36399],[-71.11833,42.36395],[-71.11829,42.36391],[-71.11819,42.3638],[-71.11814,42.36332],[-71.